{
  "$schema": "../../../protocol/schemas/adapter-codec-fixture.schema.json",
  "schemaVersion": 1,
  "encodingCases": [
    {
      "name": "dusk settle_flash_liquidation",
      "specificationKey": "dusk:settle_flash_liquidation",
      "arguments": {},
      "argumentLayoutSha256": "4f53cda18c2baa0c0354bb5f9a3ecbe5ed12ab4d8e11ba873c2f11161202b945",
      "expectedDataHex": "a15d5938857c4f14"
    },
    {
      "name": "dusk preview_flash_liquidation",
      "specificationKey": "dusk:preview_flash_liquidation",
      "arguments": {
        "debtAsset": 0,
        "maxRepayment": "18446744073709551615",
        "full": false
      },
      "argumentLayoutSha256": "da16a377f6f95925aa7ee312fb0d38ab6fc5950227dd9805c6e134a79a7fa4b5",
      "expectedDataHex": "ee5e7af3d6aff60300ffffffffffffffff00"
    },
    {
      "name": "dusk preview_emergency_liquidation",
      "specificationKey": "dusk:preview_emergency_liquidation",
      "arguments": {
        "debtAsset": 1,
        "collateralDebit": "1000",
        "full": true
      },
      "argumentLayoutSha256": "071c408eeccffc206d586057175603944490150ad6025b6001810dacffabb428",
      "expectedDataHex": "4bc8420070e6183801e80300000000000001"
    },
    {
      "name": "dusk observe_liquidation",
      "specificationKey": "dusk:observe_liquidation",
      "arguments": {
        "debtAsset": 1
      },
      "argumentLayoutSha256": "71eeeccd4dccfd47308be8968bf9195b874b31ba06b9dcef4015bf558717ff38",
      "expectedDataHex": "8e9fbdd4f53c367101"
    },
    {
      "name": "dusk begin_flash_liquidation",
      "specificationKey": "dusk:begin_flash_liquidation",
      "arguments": {
        "position": "EZRBRwQggd2X92LWBYSiZRCFV3KHMgXEhYe3fMpw6nx2",
        "debtAsset": 1,
        "maxRepayment": "1000",
        "maxPayment": "1100",
        "minCollateralCredit": "900",
        "full": false,
        "settleIndex": 3
      },
      "argumentLayoutSha256": "dcfaeab98371e9493a40b339d2bda9ebc366bc4e60b402030a8dbd2e4994dba7",
      "expectedDataHex": "12f22f2acb2d62fcc975db2caeb015a2fef7e82d1164730c71d712bec0fa84c2cf1b00f06bb1345301e8030000000000004c040000000000008403000000000000000300"
    },
    {
      "name": "dusk emergency_liquidation",
      "specificationKey": "dusk:emergency_liquidation",
      "arguments": {
        "debtAsset": 0,
        "collateralDebit": "1000",
        "full": false,
        "minRewardCredit": "1",
        "minSwapOutput": "900"
      },
      "argumentLayoutSha256": "33cacc19b128cbba371ff46d48d21dc17ba2c8a83b20b69f8dc8639b64d6ca84",
      "expectedDataHex": "185f76884dc22cf700e8030000000000000001000000000000008403000000000000"
    },
    {
      "name": "dusk delegated_close_leverage",
      "specificationKey": "dusk:delegated_close_leverage",
      "arguments": {
        "debtAsset": 0,
        "minAmountOut": "800",
        "closeBps": 10000,
        "beforeIxDataHex": "05236f00df83c11f0807060504030201",
        "afterIxDataHex": "9ce0eefa5fe5eb3b0700000000000000",
        "beforeAccountsLen": 8
      },
      "argumentLayoutSha256": "3d78e829d2a4b89c975f0957845b52eb4e949b38ac8ea16d91362c0d0e3244e0",
      "expectedDataHex": "0eda6299a413308b00200300000000000010271000000005236f00df83c11f0807060504030201100000009ce0eefa5fe5eb3b07000000000000000800"
    },
    {
      "name": "leverage_delegate before_take_profit",
      "specificationKey": "leverage_delegate:before_take_profit",
      "arguments": {
        "orderId": "72623859790382856"
      },
      "argumentLayoutSha256": "8d1d15f0f2c7bea4435e7c3ce00fc59e960ec07c34714923cd9ebd0cc1ae953c",
      "expectedDataHex": "05236f00df83c11f0807060504030201"
    },
    {
      "name": "leverage_delegate after_close_order",
      "specificationKey": "leverage_delegate:after_close_order",
      "arguments": {
        "orderId": "7"
      },
      "argumentLayoutSha256": "8d1d15f0f2c7bea4435e7c3ce00fc59e960ec07c34714923cd9ebd0cc1ae953c",
      "expectedDataHex": "9ce0eefa5fe5eb3b0700000000000000"
    },
    {
      "name": "leverage_delegate before_stop_loss",
      "specificationKey": "leverage_delegate:before_stop_loss",
      "arguments": {
        "orderId": "18446744073709551615"
      },
      "argumentLayoutSha256": "8d1d15f0f2c7bea4435e7c3ce00fc59e960ec07c34714923cd9ebd0cc1ae953c",
      "expectedDataHex": "f63e52e8a8c7794effffffffffffffff"
    },
    {
      "name": "dusk settle_protocol_auction",
      "specificationKey": "dusk:settle_protocol_auction",
      "arguments": {
        "lane": "buyback",
        "source": "interest",
        "soldAmount": "1000",
        "maxPaymentAmount": "950"
      },
      "argumentLayoutSha256": "20a24b8b7bf95f2a14b8cb3ddd89789964e020f3584cc7246748cca7f5065665",
      "expectedDataHex": "cecc2087081648500101e803000000000000b603000000000000"
    },
    {
      "name": "dusk queue_parameter_proposal",
      "specificationKey": "dusk:queue_parameter_proposal",
      "arguments": {},
      "argumentLayoutSha256": "4f53cda18c2baa0c0354bb5f9a3ecbe5ed12ab4d8e11ba873c2f11161202b945",
      "expectedDataHex": "c259a444fdfb156c"
    },
    {
      "name": "dusk execute_parameter_proposal",
      "specificationKey": "dusk:execute_parameter_proposal",
      "arguments": {},
      "argumentLayoutSha256": "4f53cda18c2baa0c0354bb5f9a3ecbe5ed12ab4d8e11ba873c2f11161202b945",
      "expectedDataHex": "2e6a707128ff9a1b"
    }
  ],
  "invalidEncodingCases": [
    {
      "name": "unknown instruction",
      "specificationKey": "dusk:not_a_keeper_instruction",
      "arguments": {},
      "expectedError": "unsupported_instruction"
    },
    {
      "name": "u64 overflow",
      "specificationKey": "dusk:preview_flash_liquidation",
      "arguments": {
        "debtAsset": 0,
        "full": false,
        "maxRepayment": "18446744073709551616"
      },
      "expectedError": "invalid_arguments"
    },
    {
      "name": "negative u64",
      "specificationKey": "dusk:preview_flash_liquidation",
      "arguments": {
        "debtAsset": 0,
        "full": false,
        "maxRepayment": "-1"
      },
      "expectedError": "invalid_arguments"
    },
    {
      "name": "non-canonical u64",
      "specificationKey": "dusk:preview_flash_liquidation",
      "arguments": {
        "debtAsset": 0,
        "full": false,
        "maxRepayment": "+1"
      },
      "expectedError": "invalid_arguments"
    },
    {
      "name": "u8 overflow",
      "specificationKey": "dusk:observe_liquidation",
      "arguments": {
        "debtAsset": 256
      },
      "expectedError": "invalid_arguments"
    },
    {
      "name": "unknown protocol auction enum",
      "specificationKey": "dusk:settle_protocol_auction",
      "arguments": {
        "lane": "treasury",
        "source": "interest",
        "soldAmount": "1",
        "maxPaymentAmount": "1"
      },
      "expectedError": "invalid_arguments"
    },
    {
      "name": "malformed delegated hook hex",
      "specificationKey": "dusk:delegated_close_leverage",
      "arguments": {
        "debtAsset": 0,
        "minAmountOut": "1",
        "beforeIxDataHex": "abc",
        "afterIxDataHex": "00",
        "beforeAccountsLen": 1
      },
      "expectedError": "invalid_arguments"
    },
    {
      "name": "unexpected no-argument field",
      "specificationKey": "dusk:queue_parameter_proposal",
      "arguments": {
        "invented": true
      },
      "expectedError": "invalid_arguments"
    }
  ],
  "pdaCases": [
    {
      "name": "dusk market",
      "recipeKey": "dusk:market",
      "inputs": {
        "baseAssetMint": "75zkLdzuZUnXqVCJi9ocF2ujaryecBPUwDqJVViREpbN",
        "quoteAssetMint": "ES5SwuoAYbS8WzFGDuAqezp4w9zPyxg1cSTXkgccPrS8",
        "paramsHash": "1c2e7deab60101b4bb17bb1b3c96a1272bab1e359de0d62bbbf5025e5eac7fd8"
      },
      "expectedAddress": "GftXnbmUMgR9S1Pagc4vppPQQmk8m5PTZVAMFDYDk1zQ",
      "expectedBump": 255
    },
    {
      "name": "dusk futarchy_authority",
      "recipeKey": "dusk:futarchy_authority",
      "inputs": {},
      "expectedAddress": "6ahW8Jmw4F1kzDxzA9vps9qrxMdjtQBCw3itSqYn9NZY",
      "expectedBump": 254
    },
    {
      "name": "dusk session",
      "recipeKey": "dusk:session",
      "inputs": {
        "position": "6RAKkz6gd1Sr382vUtatNx2ovWxYq9MJyDk3mo3QiPj4"
      },
      "expectedAddress": "8dBXDkDEEuVP27ComwfMoXFdCUCrZuwdzCejU6ygcGQU",
      "expectedBump": 254
    },
    {
      "name": "dusk event_authority",
      "recipeKey": "dusk:event_authority",
      "inputs": {},
      "expectedAddress": "5wiTA28gz5WFdEYxNVeZu288WCdZWzaonA1pnApLWSuh",
      "expectedBump": 254
    },
    {
      "name": "dusk repayment_vault",
      "recipeKey": "dusk:repayment_vault",
      "inputs": {
        "position": "6z5zyNSTKbaKCQV9eC4wsQzCZBuQaNdK66bts8PhZ1Bf",
        "debtMint": "7rDuQtFf2FfwtChaHvLrrAJb1249XcJUGDkkKe9XrS21"
      },
      "expectedAddress": "6jnBbUHqMQ37cUfobWqoTskT18rzWSt4tSsfFDRQAcqq",
      "expectedBump": 252
    },
    {
      "name": "dusk leverage_position",
      "recipeKey": "dusk:leverage_position",
      "inputs": {
        "market": "E6iqYDhkzmbxnUdnbPBNqG7Uv1aWTVXgBQDh3BRw53m6",
        "owner": "2qTwGJ4jctJbAB6PuXW7mnTmMsftHvsF11diztD8kDV8",
        "namespaceAuthority": "FZZme4786Mp2RhSZF7RvHGkLmxfwqANFs7vyATznRk7V",
        "positionId": "4cxjy9EweZSD4Y3Zst7dpYCcKSQ27JDdzrMmBLR8gVbu"
      },
      "expectedAddress": "DQ8XKpE5jMTXazSvu5885Y5q4MXbnGhTkbrBuZndDg1u",
      "expectedBump": 255
    },
    {
      "name": "dusk leverage_collateral_vault",
      "recipeKey": "dusk:leverage_collateral_vault",
      "inputs": {
        "market": "EGrkf7cgnJhTaDCPa2qx5iY1u2XM5B3rZE7c9NsGaT3C",
        "collateralMint": "8A2SZcybi6uUhWaNHbdSPB6Xmhn9hQRao4xrGpLfMgqk"
      },
      "expectedAddress": "5ou4wgyp4V38cbMhyyMd1L7kydGVmDRdnno1DvS3vdLP",
      "expectedBump": 252
    },
    {
      "name": "leverage_delegate order",
      "recipeKey": "leverage_delegate:order",
      "inputs": {
        "position": "CKHPzoPsN7TZVd9imyjKoZeZ4uG8EcSw6Bo7QJpzKpYP",